{
  "schema_version": 1,
  "device_id": "cardioia-esp32-01",
  "session_id": "0123456789abcdef",
  "sequence": 1,
  "collected_uptime_ms": 5000,
  "window_ms": 5000,
  "temperature_c": 24.0,
  "humidity_pct": 40.0,
  "pulse_count": 6,
  "heart_rate_bpm": 72.0,
  "dht_valid": true,
  "dropped_total": 0,
  "backlog_samples": 1,
  "simulated": true,
  "transport": "serial_demo"
}
