[
  {
    "schema_version": 1,
    "device_id": "cardioia-esp32-01",
    "session_id": "66d5bec5f7007c6a",
    "sequence": 1,
    "collected_uptime_ms": 6395,
    "window_ms": 5000,
    "temperature_c": 24,
    "humidity_pct": 40,
    "pulse_count": 0,
    "heart_rate_bpm": 0,
    "dht_valid": true,
    "dropped_total": 0,
    "backlog_samples": 1,
    "simulated": true,
    "transport": "mqtt",
    "sent_uptime_ms": 6395,
    "age_ms": 0,
    "attempt": 1,
    "replay": false
  },
  {
    "schema_version": 1,
    "device_id": "cardioia-esp32-01",
    "session_id": "66d5bec5f7007c6a",
    "sequence": 2,
    "collected_uptime_ms": 11395,
    "window_ms": 5000,
    "temperature_c": 24,
    "humidity_pct": 40,
    "pulse_count": 24,
    "heart_rate_bpm": 288,
    "dht_valid": true,
    "dropped_total": 0,
    "backlog_samples": 1,
    "simulated": true,
    "transport": "mqtt",
    "sent_uptime_ms": 11395,
    "age_ms": 0,
    "attempt": 1,
    "replay": false
  },
  {
    "schema_version": 1,
    "device_id": "cardioia-esp32-01",
    "session_id": "66d5bec5f7007c6a",
    "sequence": 3,
    "collected_uptime_ms": 16395,
    "window_ms": 5000,
    "temperature_c": 24,
    "humidity_pct": 40,
    "pulse_count": 3,
    "heart_rate_bpm": 36,
    "dht_valid": true,
    "dropped_total": 0,
    "backlog_samples": 1,
    "simulated": true,
    "transport": "mqtt",
    "sent_uptime_ms": 16395,
    "age_ms": 0,
    "attempt": 1,
    "replay": false
  },
  {
    "schema_version": 1,
    "device_id": "cardioia-esp32-01",
    "session_id": "66d5bec5f7007c6a",
    "sequence": 4,
    "collected_uptime_ms": 21395,
    "window_ms": 5000,
    "temperature_c": 24,
    "humidity_pct": 40,
    "pulse_count": 0,
    "heart_rate_bpm": 0,
    "dht_valid": true,
    "dropped_total": 0,
    "backlog_samples": 1,
    "simulated": true,
    "transport": "mqtt",
    "sent_uptime_ms": 21395,
    "age_ms": 0,
    "attempt": 1,
    "replay": false
  },
  {
    "schema_version": 1,
    "device_id": "cardioia-esp32-01",
    "session_id": "66d5bec5f7007c6a",
    "sequence": 5,
    "collected_uptime_ms": 26395,
    "window_ms": 5000,
    "temperature_c": 24,
    "humidity_pct": 40,
    "pulse_count": 0,
    "heart_rate_bpm": 0,
    "dht_valid": true,
    "dropped_total": 0,
    "backlog_samples": 1,
    "simulated": true,
    "transport": "mqtt",
    "sent_uptime_ms": 26395,
    "age_ms": 0,
    "attempt": 1,
    "replay": false
  },
  {
    "schema_version": 1,
    "device_id": "cardioia-esp32-01",
    "session_id": "66d5bec5f7007c6a",
    "sequence": 6,
    "collected_uptime_ms": 31395,
    "window_ms": 5000,
    "temperature_c": 24,
    "humidity_pct": 40,
    "pulse_count": 0,
    "heart_rate_bpm": 0,
    "dht_valid": true,
    "dropped_total": 0,
    "backlog_samples": 1,
    "simulated": true,
    "transport": "mqtt",
    "sent_uptime_ms": 31395,
    "age_ms": 0,
    "attempt": 1,
    "replay": false
  },
  {
    "schema_version": 1,
    "device_id": "cardioia-esp32-01",
    "session_id": "66d5bec5f7007c6a",
    "sequence": 7,
    "collected_uptime_ms": 36395,
    "window_ms": 5000,
    "temperature_c": 24,
    "humidity_pct": 40,
    "pulse_count": 0,
    "heart_rate_bpm": 0,
    "dht_valid": true,
    "dropped_total": 0,
    "backlog_samples": 1,
    "simulated": true,
    "transport": "mqtt",
    "sent_uptime_ms": 36395,
    "age_ms": 0,
    "attempt": 1,
    "replay": false
  }
]